{"$schema":"https://json-schema.org/draft/2020-12/schema","title":"Installed Product Workflow State","type":"object","required":["schema_version","repository","authorized_branch","framework_identity","release_target","current_milestone","current_status","current_build","next_owner","next_command"],"properties":{"schema_version":{"const":3},"repository":{"type":"string","minLength":1},"authorized_branch":{"type":"string","minLength":1},"framework_identity":{"type":"string","minLength":1},"release_target":{"type":"string","minLength":1},"current_milestone":{"type":["string","null"]},"current_status":{"type":["string","null"]},"current_build":{"type":["string","null"]},"next_owner":{"type":["string","null"]},"next_command":{"type":["string","null"]}},"additionalProperties":false}
