{
  "schema_version": 3,
  "repository": "jumpvin/Atlas-Shipping",
  "authorized_branch": "bootstrap/atlas-initialization",
  "framework_identity": "0.3.9-dev.18.9",
  "release_target": "0.1.x",
  "current_milestone": "ATLAS-M004",
  "current_status": "active",
  "current_build": "0.1.8",
  "next_owner": "Builder",
  "next_command": "Implement Milestone"
}
